<?xml version="1.0"?>
<!DOCTYPE Report
[
<!ELEMENT Report (General ,(Doc|BPT)) >
<!ATTLIST Report ver CDATA #REQUIRED tmZone CDATA #REQUIRED>

<!ELEMENT General ( DocLocation ) >
<!ATTLIST General productName CDATA #REQUIRED productVer CDATA #REQUIRED os CDATA #REQUIRED host CDATA #REQUIRED qcserver CDATA #IMPLIED qcproject CDATA #IMPLIED SolManSolutionId CDATA #IMPLIED SolManProjectId CDATA #IMPLIED SolManTestPlanId CDATA #IMPLIED SolManTestPackageId CDATA #IMPLIED SolManUserInfoData CDATA #IMPLIED  >

<!ELEMENT BPT (DName,Res,DVer?,TSet?,TInst?,NodeArgs,AdditionalInfo*,Doc*) >
<!ATTLIST BPT rID ID #REQUIRED >

<!ELEMENT Doc (DName,ConfName?,Res,DVer?,TSet?,TInst?,RunType?,DT?,AdditionalInfo*,Step*,DIter*,Step*,Action*,Doc*,Summary?,TestMaintenanceSummary*,NodeArgs?) >
<!ATTLIST Doc rID ID #REQUIRED type (Test|BC|BPTWrapperTest|Flow|Group|Action) "Test" productName CDATA #REQUIRED BCIter CDATA #IMPLIED >

<!ELEMENT RunType ( #PCDATA )>
<!ATTLIST RunType fmStep (False|True) "False" batch (False|True) "False" upDesc (False|True) "False" upChk (False|True) "False" upAS (False|True) "False">

<!ELEMENT DName ( #PCDATA ) >

<!ELEMENT ConfName ( #PCDATA ) >

<!ELEMENT Res ( #PCDATA ) >

<!ELEMENT AdditionalInfo (AdditionalDataName,AdditionalDataValue ) >

<!ELEMENT AdditionalDataName ( #PCDATA ) >

<!ELEMENT AdditionalDataValue ( #PCDATA ) >

<!ELEMENT DVer ( #PCDATA ) >

<!ELEMENT TSet ( #PCDATA ) >

<!ELEMENT TInst ( #PCDATA ) >

<!ELEMENT DIter (Step*,Action+,Summary?,NodeArgs)>
<!ATTLIST DIter rID ID #REQUIRED iterID CDATA #REQUIRED>

<!ELEMENT DocLocation ( #PCDATA )>

<!ELEMENT Action (AName,AIter*,(Step|HtmlStep|Action)*, Summary,ActionMaintenanceSummary*, NodeArgs ) >
<!ATTLIST Action rID ID #REQUIRED>

<!ELEMENT AIter ((Step|HtmlStep|Action)*,DataMapping?, Summary?,NodeArgs) >
<!ATTLIST AIter rID ID #REQUIRED iterID CDATA #REQUIRED isCountable (False|True) "False" >

<!ELEMENT AName ( #PCDATA ) >

<!ELEMENT TestMaintenanceSummary (ActionMaintenanceSummary*) >
<!ATTLIST TestMaintenanceSummary ObjectsAdded CDATA #REQUIRED ObjectsUpdated CDATA #REQUIRED StepsUpdated CDATA #REQUIRED StepsComments CDATA #REQUIRED><!ELEMENT ActionMaintenanceSummary (ObjectChange* ) >
<!ATTLIST ActionMaintenanceSummary Action CDATA #REQUIRED Objects CDATA #REQUIRED Updated CDATA #REQUIRED LinesTotal CDATA #REQUIRED Added CDATA #REQUIRED LinesUpdated CDATA #REQUIRED>

<!ELEMENT ObjectChange  (Hierarchy, PropertyChangeList* ) >
<!ATTLIST ObjectChange Operation CDATA #IMPLIED OriginalRepository CDATA #IMPLIED>

<!ELEMENT PropertyChangeList (PropertyDef*) >

<!ELEMENT PropertyDef (OriginalValue, NewValue) >
<!ATTLIST PropertyDef PropName CDATA #REQUIRED OriginRegularExpression (True|False) "False" NewRegularExpression (True|False) "False" AddedProperty (True|False) "False" >

<!ELEMENT OriginalValue ( #PCDATA )>

<!ELEMENT NewValue ( #PCDATA )>

<!ELEMENT Hierarchy  (ObjectName, Hierarchy*) >
<!ATTLIST Hierarchy MicClass CDATA #REQUIRED>

<!ELEMENT ObjectName  ( #PCDATA ) >

<!ELEMENT Step (Obj,Details,Time,TimeTick* ,(Step|HtmlStep|Doc)*, DataMapping?, NodeArgs) >
<!ATTLIST Step rID ID #REQUIRED retval CDATA #IMPLIED>

<!ELEMENT HtmlStep (HTML,TimeTick*,(Step|HtmlStep|Doc)*,NodeArgs) >
<!ATTLIST HtmlStep rID ID #REQUIRED >

<!ELEMENT Obj ( #PCDATA ) >
<!ATTLIST Obj plainTxt (False|True) "True">

<!ELEMENT Details ( #PCDATA ) >
<!ATTLIST Details plainTxt (False|True) "True">

<!ELEMENT Time ( #PCDATA ) >

<!ELEMENT HTML ( #PCDATA ) >

<!ELEMENT Disp ( #PCDATA ) >

<!ELEMENT TimeTick ( #PCDATA ) >

<!ELEMENT DataMapping ( DataMappedItem* )>
<!ELEMENT DataMappedItem EMPTY >
<!ATTLIST DataMappedItem dsName CDATA #REQUIRED >
<!ATTLIST DataMappedItem rowId CDATA #REQUIRED >

<!ELEMENT NodeArgs (Disp,TopPane?,BtmPane?,ExtendedInfo? )>
<!ATTLIST NodeArgs eType CDATA #REQUIRED icon CDATA #REQUIRED nRep CDATA #REQUIRED UserNote CDATA #IMPLIED filter (False|True) "True">
<!ATTLIST NodeArgs status (Passed|Failed|Done|Warning|Information) "Done">
<!ATTLIST NodeArgs iconSel CDATA #IMPLIED nType CDATA #IMPLIED MovieMarker CDATA "">
<!ATTLIST NodeArgs Source CDATA #IMPLIED SourceLine CDATA #IMPLIED StepFlowItemKey CDATA #IMPLIED >

<!ELEMENT TopPane (Path)>

<!ELEMENT BtmPane ( (Path|WR)?,ASHilite?)>
<!ATTLIST BtmPane vType CDATA "HTML">

<!ELEMENT Path ( #PCDATA ) >

<!ELEMENT ASHilite ( #PCDATA ) >

<!ELEMENT WR ( #PCDATA ) >

<!ELEMENT ExtendedInfo ( StepData ) >

<!ATTLIST ExtendedInfo StepType CDATA #REQUIRED>
<!ELEMENT DT (NodeArgs) >
<!ATTLIST DT rID ID #REQUIRED>

<!ELEMENT Summary (Param*)>
<!ATTLIST Summary sTime CDATA #IMPLIED eTime CDATA #IMPLIED passed CDATA #IMPLIED failed CDATA #IMPLIED warnings CDATA #IMPLIED retval CDATA #IMPLIED stopped (False|True) "False" >

<!ELEMENT Param (ParamName,ParamVal)+ >
<!ATTLIST Param paramInOut (In|Out) "In">

<!ELEMENT ParamName ( #PCDATA ) >

<!ELEMENT ParamVal ( #PCDATA ) >

]
>
<Report ver="2.0" tmZone="Paris, Madrid">
<General productName="Micro Focus Unified Functional Testing" productVer="15.0.2" os="" host="NXQLX208"><DocLocation><![CDATA[C:\Users\tdemijolla\Desktop\Dev\Tests\MoodleEdge\ConsulterCoursKO]]></DocLocation></General>
<Doc rID="T1"   productName= "Micro Focus Unified Functional Testing"  >
<DName><![CDATA[ConsulterCoursKO]]></DName>
<Res><![CDATA[Res2]]></Res>
<DT rID="T2">
<NodeArgs eType="Table" icon="2" nRep="4" filter="False" >
<Disp><![CDATA[Run-Time Data Table]]></Disp>
<BtmPane vType="Table" >
<Path><![CDATA[Default.xlsx]]></Path>
</BtmPane>
</NodeArgs>
</DT>
<DIter rID="T3" iterID="1" >
<Step rID="T4">
<Obj plainTxt="False" ><![CDATA[StartUp Browser]]></Obj>
<Details plainTxt="False" ><![CDATA[<table><tr><td><span style="text-align : left; font-size : 12px; ">Local Browser</span></td></tr></table>]]></Details>
<Time><![CDATA[31/05/2021 - 18:08:00]]></Time>
<TimeTick>1622477280</TimeTick>
<Step rID="T5">
<Obj plainTxt="False" ><![CDATA[StartUp Browser.Navigate]]></Obj>
<Details plainTxt="False" ><![CDATA[Naviguer vers https://moodle.ecoleql.fr]]></Details>
<Time><![CDATA[31/05/2021 - 18:08:01]]></Time>
<TimeTick>1622477281</TimeTick>
<NodeArgs eType="Replay" icon="4" nRep="9" Source="Action0" SourceLine="-1" >
<Disp><![CDATA[StartUp Browser.Navigate]]></Disp>
<BtmPane vType="ViewerGen.SSViewerGen" >
<Path><![CDATA[ZIP::Act0\Row1\ssf2.xml]]></Path>
<ASHilite><![CDATA[2690190]]></ASHilite>
</BtmPane>
</NodeArgs>
</Step>
<Step rID="T6">
<Obj plainTxt="False" ><![CDATA[StartUp Browser.Sync]]></Obj>
<Details plainTxt="False" ><![CDATA[]]></Details>
<Time><![CDATA[31/05/2021 - 18:08:01]]></Time>
<TimeTick>1622477281</TimeTick>
<NodeArgs eType="Replay" icon="4" nRep="11" Source="Action0" SourceLine="-1" >
<Disp><![CDATA[StartUp Browser.Sync]]></Disp>
<BtmPane vType="ViewerGen.SSViewerGen" >
<Path><![CDATA[ZIP::Act0\Row1\ssf3.xml]]></Path>
<ASHilite><![CDATA[2690190]]></ASHilite>
</BtmPane>
</NodeArgs>
</Step>
<NodeArgs eType="Context" icon="4" nRep="8" Source="Action0" SourceLine="-1" >
<Disp><![CDATA[StartUp Browser]]></Disp>
<BtmPane vType="ViewerGen.SSViewerGen" >
<Path><![CDATA[ZIP::Act0\Row1\ssf1.xml]]></Path>
<ASHilite><![CDATA[2690190]]></ASHilite>
</BtmPane>
</NodeArgs>
</Step>
<Action rID="T7">
<AName><![CDATA[Action1]]></AName>
<Step rID="T8">
<Obj plainTxt="False" ><![CDATA[Ecole de la Qualité Logicielle]]></Obj>
<Details plainTxt="False" ><![CDATA[<table><tr><td><span style="text-align : left; font-size : 12px; ">Local Browser</span></td></tr></table>]]></Details>
<Time><![CDATA[31/05/2021 - 18:08:01]]></Time>
<TimeTick>1622477281</TimeTick>
<Step rID="T9">
<Obj plainTxt="False" ><![CDATA["Ecole de la Qualité Logicielle"- Identification intelligente]]></Obj>
<Details plainTxt="False" ><![CDATA[<P><span class="text">Le mécanisme d’identification intelligente a été appelé.</span></P><P><SPAN class=text>Motif : objet non unique (3 objets détectés)</SPAN></P>           <SPAN class=text><b>Description d’origine :</b></SPAN><br>micclass=Browser<br><P><FONT face=Verdana size=2><SPAN class=text><B>Autre description de l’identification intelligente : </B></SPAN></FONT></P><FONT face=Verdana size=2><u>Propriétés du filtre de base (3 objets détectés)&nbsp;</FONT></u><br>
micclass=Browser<br><br><FONT face=Verdana size=2><u>Propriétés du filtre facultatif</FONT></u><br>
name=Ecole de la Qualité Logicielle<SPAN class=passed> (Utilisé</SPAN>, 1 correspondances)</SPAN><br>title=Ecole de la Qualité Logicielle<SPAN class=warning> (Ignoré)<FONT color=#000000></FONT></SPAN><br>openurl=https://moodle.ecoleql.fr<SPAN class=warning> (Ignoré)<FONT color=#000000></FONT></SPAN><br>opentitle=Ecole de la Qualité Logicielle<SPAN class=warning> (Ignoré)<FONT color=#000000></FONT></SPAN><br>openedbytestingtool=-1<SPAN class=warning> (Ignoré)<FONT color=#000000></FONT></SPAN><br>number of tabs=1<SPAN class=warning> (Ignoré)<FONT color=#000000></FONT></SPAN><br>]]></Details>
<Time><![CDATA[31/05/2021 - 18:08:01]]></Time>
<TimeTick>1622477281</TimeTick>
<NodeArgs eType="Replay" icon="6" nRep="15" Source="Action1" SourceLine="0" >
<Disp><![CDATA["Ecole de la Qualité Logicielle"- Identification intelligente]]></Disp>
</NodeArgs>
</Step>
<Step rID="T10">
<Obj plainTxt="False" ><![CDATA[Ecole de la Qualité Logicielle]]></Obj>
<Details plainTxt="False" ><![CDATA[Page]]></Details>
<Time><![CDATA[31/05/2021 - 18:08:01]]></Time>
<TimeTick>1622477281</TimeTick>
<Step rID="T11">
<Obj plainTxt="False" ><![CDATA[Connexion.Click]]></Obj>
<Details plainTxt="False" ><![CDATA[]]></Details>
<Time><![CDATA[31/05/2021 - 18:08:01]]></Time>
<TimeTick>1622477281</TimeTick>
<NodeArgs eType="Replay" icon="8" nRep="18" Source="Action1" SourceLine="0" >
<Disp><![CDATA[Connexion.Click]]></Disp>
<BtmPane vType="Mercury.SSHWeb" >
<Path><![CDATA[ZIP::Act1\Row0\ssf2.xml]]></Path>
<ASHilite><![CDATA[10000000]]></ASHilite>
</BtmPane>
</NodeArgs>
</Step>
<NodeArgs eType="Context" icon="7" nRep="17" Source="Action1" SourceLine="0" >
<Disp><![CDATA[Ecole de la Qualité Logicielle]]></Disp>
<BtmPane vType="Mercury.SSHWeb" >
<Path><![CDATA[ZIP::Act1\Row0\ssf1.xml]]></Path>
<ASHilite><![CDATA[10000000]]></ASHilite>
</BtmPane>
</NodeArgs>
</Step>
<Step rID="T12">
<Obj plainTxt="False" ><![CDATA[Ecole de la Qualité Logicielle_2]]></Obj>
<Details plainTxt="False" ><![CDATA[Page]]></Details>
<Time><![CDATA[31/05/2021 - 18:08:02]]></Time>
<TimeTick>1622477282</TimeTick>
<Step rID="T13">
<Obj plainTxt="False" ><![CDATA[username.Set]]></Obj>
<Details plainTxt="False" ><![CDATA["stagiairedta"]]></Details>
<Time><![CDATA[31/05/2021 - 18:08:03]]></Time>
<TimeTick>1622477283</TimeTick>
<NodeArgs eType="Replay" icon="9" nRep="22" Source="Action1" SourceLine="2" >
<Disp><![CDATA[username.Set]]></Disp>
<BtmPane vType="Mercury.SSHWeb" >
<Path><![CDATA[ZIP::Act1\Row0\ssf4.xml]]></Path>
<ASHilite><![CDATA[10000000]]></ASHilite>
</BtmPane>
</NodeArgs>
</Step>
<Step rID="T14">
<Obj plainTxt="False" ><![CDATA[password.SetSecure]]></Obj>
<Details plainTxt="False" ><![CDATA["60b4fe8d9995ee042360479cfb0c97bd2bf717c634a638b2a9a7b698bc1c162a16c9"]]></Details>
<Time><![CDATA[31/05/2021 - 18:08:04]]></Time>
<TimeTick>1622477284</TimeTick>
<NodeArgs eType="Replay" icon="9" nRep="25" Source="Action1" SourceLine="4" >
<Disp><![CDATA[password.SetSecure]]></Disp>
<BtmPane vType="Mercury.SSHWeb" >
<Path><![CDATA[ZIP::Act1\Row0\ssf5.xml]]></Path>
<ASHilite><![CDATA[10000000]]></ASHilite>
</BtmPane>
</NodeArgs>
</Step>
<Step rID="T15">
<Obj plainTxt="False" ><![CDATA[Connexion.Click]]></Obj>
<Details plainTxt="False" ><![CDATA[]]></Details>
<Time><![CDATA[31/05/2021 - 18:08:05]]></Time>
<TimeTick>1622477285</TimeTick>
<NodeArgs eType="Replay" icon="10" nRep="28" Source="Action1" SourceLine="6" >
<Disp><![CDATA[Connexion.Click]]></Disp>
<BtmPane vType="Mercury.SSHWeb" >
<Path><![CDATA[ZIP::Act1\Row0\ssf6.xml]]></Path>
<ASHilite><![CDATA[10000000]]></ASHilite>
</BtmPane>
</NodeArgs>
</Step>
<NodeArgs eType="Context" icon="7" nRep="21" Source="Action1" SourceLine="2" >
<Disp><![CDATA[Ecole de la Qualité Logicielle_2]]></Disp>
<BtmPane vType="Mercury.SSHWeb" >
<Path><![CDATA[ZIP::Act1\Row0\ssf3.xml]]></Path>
<ASHilite><![CDATA[10000000]]></ASHilite>
</BtmPane>
</NodeArgs>
</Step>
<Step rID="T16">
<Obj plainTxt="False" ><![CDATA[Tableau de bord]]></Obj>
<Details plainTxt="False" ><![CDATA[Page]]></Details>
<Time><![CDATA[31/05/2021 - 18:08:06]]></Time>
<TimeTick>1622477286</TimeTick>
<Step rID="T17">
<Obj plainTxt="False" ><![CDATA[Eguru.Click]]></Obj>
<Details plainTxt="False" ><![CDATA[]]></Details>
<Time><![CDATA[31/05/2021 - 18:08:06]]></Time>
<TimeTick>1622477286</TimeTick>
<NodeArgs eType="Replay" icon="11" nRep="32" Source="Action1" SourceLine="8" >
<Disp><![CDATA[Eguru.Click]]></Disp>
<BtmPane vType="Mercury.SSHWeb" >
<Path><![CDATA[ZIP::Act1\Row0\ssf8.xml]]></Path>
<ASHilite><![CDATA[10000000]]></ASHilite>
</BtmPane>
</NodeArgs>
</Step>
<NodeArgs eType="Context" icon="7" nRep="31" Source="Action1" SourceLine="8" >
<Disp><![CDATA[Tableau de bord]]></Disp>
<BtmPane vType="Mercury.SSHWeb" >
<Path><![CDATA[ZIP::Act1\Row0\ssf7.xml]]></Path>
<ASHilite><![CDATA[10000000]]></ASHilite>
</BtmPane>
</NodeArgs>
</Step>
<Step rID="T18">
<Obj plainTxt="False" ><![CDATA[Ecole de la Qualité Logicielle_3]]></Obj>
<Details plainTxt="False" ><![CDATA[Page]]></Details>
<Time><![CDATA[31/05/2021 - 18:08:08]]></Time>
<TimeTick>1622477288</TimeTick>
<Step rID="T19">
<Obj plainTxt="False" ><![CDATA[Processus de sélection.Click]]></Obj>
<Details plainTxt="False" ><![CDATA[]]></Details>
<Time><![CDATA[31/05/2021 - 18:08:08]]></Time>
<TimeTick>1622477288</TimeTick>
<NodeArgs eType="Replay" icon="8" nRep="36" Source="Action1" SourceLine="10" >
<Disp><![CDATA[Processus de sélection.Click]]></Disp>
<BtmPane vType="Mercury.SSHWeb" >
<Path><![CDATA[ZIP::Act1\Row0\ssf10.xml]]></Path>
<ASHilite><![CDATA[10000000]]></ASHilite>
</BtmPane>
</NodeArgs>
</Step>
<NodeArgs eType="Context" icon="7" nRep="35" Source="Action1" SourceLine="10" >
<Disp><![CDATA[Ecole de la Qualité Logicielle_3]]></Disp>
<BtmPane vType="Mercury.SSHWeb" >
<Path><![CDATA[ZIP::Act1\Row0\ssf9.xml]]></Path>
<ASHilite><![CDATA[10000000]]></ASHilite>
</BtmPane>
</NodeArgs>
</Step>
<Step rID="T20">
<Obj plainTxt="False" ><![CDATA[EQL: Tous les cours]]></Obj>
<Details plainTxt="False" ><![CDATA[Page]]></Details>
<Time><![CDATA[31/05/2021 - 18:08:09]]></Time>
<TimeTick>1622477289</TimeTick>
<Step rID="T21">
<Obj plainTxt="False" ><![CDATA[Préparation CV/Entretien.Click]]></Obj>
<Details plainTxt="False" ><![CDATA[]]></Details>
<Time><![CDATA[31/05/2021 - 18:08:09]]></Time>
<TimeTick>1622477289</TimeTick>
<NodeArgs eType="Replay" icon="8" nRep="40" Source="Action1" SourceLine="12" >
<Disp><![CDATA[Préparation CV/Entretien.Click]]></Disp>
<BtmPane vType="Mercury.SSHWeb" >
<Path><![CDATA[ZIP::Act1\Row0\ssf12.xml]]></Path>
<ASHilite><![CDATA[10000000]]></ASHilite>
</BtmPane>
</NodeArgs>
</Step>
<NodeArgs eType="Context" icon="7" nRep="39" Source="Action1" SourceLine="12" >
<Disp><![CDATA[EQL: Tous les cours]]></Disp>
<BtmPane vType="Mercury.SSHWeb" >
<Path><![CDATA[ZIP::Act1\Row0\ssf11.xml]]></Path>
<ASHilite><![CDATA[10000000]]></ASHilite>
</BtmPane>
</NodeArgs>
</Step>
<NodeArgs eType="Context" icon="4" nRep="14" Source="Action1" SourceLine="0" >
<Disp><![CDATA[Ecole de la Qualité Logicielle]]></Disp>
</NodeArgs>
</Step>
<Step rID="T22">
<Obj plainTxt="False" ><![CDATA[Ecole de la Qualité Logicielle]]></Obj>
<Details plainTxt="False" ><![CDATA[<table><tr><td><span style="text-align : left; font-size : 12px; ">Local Browser</span></td></tr></table>]]></Details>
<Time><![CDATA[31/05/2021 - 18:08:10]]></Time>
<TimeTick>1622477290</TimeTick>
<Step rID="T23">
<Obj plainTxt="False" ><![CDATA[Erreur d’exécution]]></Obj>
<Details plainTxt="False" ><![CDATA[L’objet PO : Préparation CV/Entretien &quot;Link&quot; est introuvable dans le référentiel d’objets.<BR/>Vérifiez le référentiel d’objets pour confirmer l’existence de l’objet ou rechercher le nom exact de l’objet.<BR/>Ligne (15) : &quot;Browser(&quot;Ecole de la Qualité Logicielle&quot;).Page(&quot;EQL: Tous les cours&quot;).Link(&quot;PO : Préparation CV/Entretien&quot;).Click&quot;. ]]></Details>
<Time><![CDATA[31/05/2021 - 18:08:10]]></Time>
<TimeTick>1622477290</TimeTick>
<NodeArgs eType="Replay" icon="12" nRep="42" status="Failed" Source="Action1" SourceLine="14" >
<Disp><![CDATA[Erreur d’exécution]]></Disp>
<BtmPane vType="ViewerGen.SSViewerGen" >
<Path><![CDATA[ZIP::Act1\Row0\ssf14.xml]]></Path>
<ASHilite><![CDATA[2690190]]></ASHilite>
</BtmPane>
</NodeArgs>
</Step>
<Step rID="T24">
<Obj plainTxt="False" ><![CDATA[Arrêter l’exécution]]></Obj>
<Details plainTxt="False" ><![CDATA[Exécution arrêtée par l’utilisateur.]]></Details>
<Time><![CDATA[31/05/2021 - 18:08:21]]></Time>
<TimeTick>1622477301</TimeTick>
<NodeArgs eType="General" icon="13" nRep="43" status="Information" >
<Disp><![CDATA[Arrêter l’exécution]]></Disp>
</NodeArgs>
</Step>
<NodeArgs eType="Context" icon="4" nRep="41" status="Failed" Source="Action1" SourceLine="14" >
<Disp><![CDATA[Ecole de la Qualité Logicielle]]></Disp>
<BtmPane vType="ViewerGen.SSViewerGen" >
<Path><![CDATA[ZIP::Act1\Row0\ssf13.xml]]></Path>
<ASHilite><![CDATA[2690190]]></ASHilite>
</BtmPane>
</NodeArgs>
</Step>
<Summary sTime="31/05/2021 - 18:08:01" eTime="31/05/2021 - 18:08:21" passed="0" failed="1" warnings="0" ></Summary>
<NodeArgs eType="StartAction" icon="5" nRep="12" status="Failed" >
<Disp><![CDATA[Récapitulatif Action1]]></Disp>
</NodeArgs>
</Action>
<NodeArgs eType="StartIteration" icon="3" nRep="6" status="Failed" >
<Disp><![CDATA[Itération ConsulterCoursKO 1 (ligne 1)]]></Disp>
</NodeArgs>
</DIter>
<Summary sTime="31/05/2021 - 18:07:59" eTime="31/05/2021 - 18:08:21" passed="0" failed="1" warnings="0" ></Summary>
<NodeArgs eType="StartTest" icon="1" nRep="3" status="Failed" >
<Disp><![CDATA[Récapitulatif Test ConsulterCoursKO]]></Disp>
</NodeArgs>
</Doc>
</Report>